<?xml version="1.0" encoding="utf-8"?>
<?xml-stylesheet type="text/xsl" href="http://jsbsim.sf.net/JSBSimScript.xsl"?>
<runscript xmlns:xsi="http://www.w3.org/2001/XMLSchema-instance"
    xsi:noNamespaceSchemaLocation="http://jsbsim.sf.net/JSBSimScript.xsd"
    name="Cruise flight with steady turn in 737.">

  <description>
    This is a very simple script that trims the aircraft with running
    engines at altitude and runs out to 100 seconds. Some state data
    is printed out at ten second intervals. 
    
    There are two trimming algorithms that JSBSim uses:
    
    1) Classic trim
    2) Direct Search trim
    
    This script ONLY uses the classic trim method at this time.
  </description>

  <use aircraft="737" initialize="cruise_steady_turn_init"/> 

  <run start="0" end="100" dt="0.008333">

    <property value="0"> simulation/notify-time-trigger </property>

    <event name="Set engines running">
      <condition> sim-time-sec le 0.1 </condition>
      <set name="propulsion/engine[0]/set-running" value="1"/>
      <set name="propulsion/engine[1]/set-running" value="1"/>
      <notify/>
    </event>

    <!--
      For "do_simple_trim" (Classic trim):
      0: Longitudinal
      1: Full
      2: Ground
      3: Pullup
      4: Custom
      5: Turn
      6: None

      For "do_trim_analysis" (Direct Search trim):
      0: Longitudinal
      1: Full
      2: FullWingsLevel
      3: Turn
      4: Pullup
      5: TurnFull
      6: Ground
      7: Custom
      8: None
    -->
    
    <event name="Trim">
      <condition>
        sim-time-sec gt 0.1
      </condition>
      <set name="simulation/do_simple_trim" value="5"/>
      <!--<set name="simulation/do_trim_analysis" value="3"/>-->
      <delay>5.0</delay>
      <notify>
        <property>propulsion/engine[0]/n2</property>
        <property>propulsion/engine[1]/n2</property>
        <property>propulsion/engine[0]/thrust</property>
        <property>propulsion/engine[1]/thrust</property>
        <property>velocities/vc-kts</property>
        <property>velocities/vc-fps</property>
        <property>velocities/vt-fps</property>
        <property>attitude/phi-rad</property>
        <property>attitude/theta-rad</property>
        <property>attitude/psi-rad</property>
      </notify>
    </event>

    <event name="Repeating Notify" persistent="true">
      <description>Output message at 5 second intervals</description>
      <notify>
        <property>propulsion/engine[0]/n2</property>
        <property>propulsion/engine[1]/n2</property>
        <property>propulsion/engine[0]/thrust</property>
        <property>propulsion/engine[1]/thrust</property>
        <property>position/h-agl-ft</property>
        <property>velocities/vc-kts</property>
        <property>velocities/vc-fps</property>
        <property>velocities/vt-fps</property>
        <property>attitude/phi-rad</property>
        <property>attitude/theta-rad</property>
        <property>attitude/psi-rad</property>
      </notify>
      <condition> sim-time-sec >= simulation/notify-time-trigger </condition>
      <set name="simulation/notify-time-trigger" value="5" type="FG_DELTA"/>
    </event>

  </run>

</runscript>
