<?xml version="1.0"?>
<?xml-stylesheet type="text/xsl" href="http://jsbsim.sf.net/JSBSimScript.xsl"?>
<runscript xmlns:xsi="http://www.w3.org/2001/XMLSchema-instance"
    xsi:noNamespaceSchemaLocation="http://jsbsim.sf.net/JSBSimScript.xsd"
    name="F-16 aircraft runway test">
  <description>This run is for testing an F-16 just sitting on the runway</description>
  <use aircraft="f16" initialize="reset00"/>
  <run start="0.0" end="45" dt="0.00833333">

    <event name="15-second control surface setting">
      <condition> sim-time-sec >= 15.00 </condition>
      <set name="fcs/elevator-cmd-norm" value="0.2"/>
      <set name="fcs/aileron-cmd-norm" value="0.2"/>
      <notify/>
    </event>

    <event name="30-second control surface setting">
      <condition> sim-time-sec >= 30.00 </condition>
      <set name="fcs/elevator-cmd-norm" value="0.0"/>
      <set name="fcs/aileron-cmd-norm" value="0.0"/>
      <notify/>
    </event>

  </run>
</runscript>
